item_id,original_group
item_0001,"Panasonic Portable AM / FM Radio, Battery Operated Analog Radio, AC Powered, Silver (RF-2400D) 22.8 x 7.8 x 10.8"
item_0002,"Midland - WR120B - NOAA Emergency Weather Alert Radio - S.A.M.E. Localized Programming, Trilingual Display, 60+ Emergency Alerts, & Alarm Clock (WR120B - Box Packaging)"
item_0003,"Sanus Adjustable Height Speaker Stand - Extends 28"" to 38"" - Holds Satellite & Small Bookshelf Speakers (i.e. Bose, Harmon Kardon, Polk, JBL, KEF, Klipsch, Sony and Others) - Set of 2 - Model: HTBS"
item_0004,Logitech K350 Wave Ergonomic Keyboard with Unifying Wireless Technology - Black
item_0005,"Logitech M510 Wireless Computer Mouse ??Comfortable Shape with USB Unifying Receiver, with Back/Forward Buttons and Side-to-Side Scrolling, Dark Gray"
item_0006,"Logitech MK550 Wireless Wave Keyboard and Mouse Combo - Includes Keyboard and Mouse, Long Battery Life, Ergonomic Wave Design, Black"
item_0007,"Logitech M570 Wireless Trackball Mouse ??Ergonomic Design with Sculpted Right-Hand Shape, Compatible with Apple Mac / Microsoft, USB Unifying Receiver, Dark Gray (Discontinued by Manufacturer)"
item_0008,Logitech Wireless Mouse M525 - Red/Black
item_0009,"Anker 2-in-1 USB 3.0 SD Card Reader for SDXC, SDHC, MMC, RS-MMC, Micro SDXC, Micro SD, Micro SDHC and UHS-I Cards"
item_0010,Amazon Basics Adjustable Tablet Holder Portable Stand - Black
item_0011,"Anker 2.4G Wireless Vertical Ergonomic Optical Mouse, 800 / 1200 /1600 DPI, 5 Buttons for Laptop, Desktop, PC, Macbook - Black"
item_0012,SABRENT 4 Port USB 2.0 Data Hub with Individual LED lit Power Switches [Charging NOT Supported] for Mac & PC (HB-UMLS)
item_0013,"Amazon Basics 2-Pack USB-A 3.0 Extension Cable, 4.8Gbps High-Speed, Male to Female Gold-Plated Connectors, 6 Foot, Black"
item_0014,NETGEAR Nighthawk Smart Wi-Fi Router (R7000) - AC1900 Wireless Speed (Up to 1900 Mbps) | Up to 1800 Sq Ft Coverage & 30 Devices | 4 x 1G Ethernet and 2 USB ports | Armor Security
item_0015,"Amazon Basics 14-Inch Tablet Bag, Black"
item_0016,Amazon Basics External Hard Drive Portable Carrying Case
item_0017,1byone Amplified HD Digital TV Antenna - Support 4K 1080p and All Older TV's - Indoor Smart Switch Amplifier Signal Booster - Coax HDTV Cable/AC Adapter
item_0018,"Energizer Rechargeable AA and AAA Battery Charger (Recharge Pro) with 4 AA NiMH Rechargeable Batteries, Auto-Safety Feature, Over-Charge Protection"
item_0019,PROZOR 192KHz Digital to Analog Audio Converter DAC Digital SPDIF Optical to Analog L/R RCA Converter Toslink Optical to 3.5mm Jack Adapter for PS3 HD DVD PS4 Amp Apple TV Home Cinema
item_0020,"Mounting Dream TV Wall Mount for Most 26-55 Inch TVs, Full Motion TV Mount with Perfect Center Design, Articulating Mount Max VESA 400x400mm up to 77 LBS, Wall Mount TV Bracket MD2413-MX"
item_0021,"NETGEAR Wi-Fi Range Extender EX2700 - Coverage Up to 800 Sq Ft and 10 devices with N300 Wireless Signal Booster & Repeater (Up to 300Mbps Speed), and Compact Wall Plug Design"
item_0022,"Mounting Dream UL Listed TV Mount for Most 37-70 Inch TV, Universal Tilt TV Wall Mount Fit 16"", 18"", 24"" Stud with Loading Capacity 132lbs, Max Vesa 600 x 400mm, Low Profile Flat Wall Mount Bracket"
item_0023,"Cable Clips Management - Nightstand Accessories - Cord Organizer - Desk Cable Management - Wire Holder System - Adhesive Cord Clips - Home, Office, Cubicle, Car - Gift Idea - Black"
item_0024,"Amazon Basics 5-Pack RJ45 Cat 6 Ethernet Patch Cable, 1Gpbs Transfer Speed, Gold-Plated Connectors, 5 Foot, Black"
item_0025,"TOSLINK Cable, Optical Audio Cable ??35 feet Long Fiber Optic Cable for soundbars (TOSLINK to TOSLINK, Digital S/PDIF Cable, Stereo Systems/amplifiers/amps, Home Cinema, Xbox One/PS5) ??CableDirect"
item_0026,"Sony ZX Series Wired On-Ear Headphones with Mic, White MDR-ZX110AP"
item_0027,"Mounting Dream TV Wall Mount Swivel and Tilt for Most 26-55 Inch TV, TV Mount Perfect Center Design, Full Motion TV Mount Bracket with Articulation, up to VESA 400x400mm, 60 lbs, MD2377"
item_0028,Sony MDREX15LP/P In-Ear Headphone (Pink)
item_0029,"NETGEAR Wi-Fi Range Extender EX3700 - Coverage Up to 1000 Sq Ft and 15 Devices with AC750 Dual Band Wireless Signal Booster & Repeater (Up to 750Mbps Speed), and Compact Wall Plug Design"
item_0030,Betron YSM1000 Earphones in Ear Headphones Wired 3.5mm Jack Tangle-Free Cable Case and Noise Isolating Earbuds
item_0031,"Mounting Dream TV Wall Mount for 32-65 Inch TV, TV Mount with Swivel and Tilt, Full Motion TV Bracket with Articulating Dual Arms, Fits 16inch Studs, Max VESA 400X400 mm, 99lbs, MD2380"
item_0032,"Arteck HB030B Universal Slim Portable Wireless Bluetooth 3.0 7-Colors Backlit Keyboard with Built in Rechargeable Battery, Black"
item_0033,Apple Lightning to Digital AV Adapter
item_0034,"Screen Cleaner Kit - Best for LED & LCD TV, Computer Monitor, Laptop, and iPad Screens ??Contains Over 1,572 Sprays in Each Large 16 Ounce Bottle ??Includes Premium Microfiber Cloth"
item_0035,"NEEWER 50 in 1 Action Camera Accessory Kit Compatible with GoPro Hero 11 10 9 8 7 6 5 4 GoPro Max GoPro Fusion Insta360 DJI Osmo Action Action 2 AKASO, and more"
item_0036,"D-FantiX Battery Tester, Universal Battery Checker Small Battery Testers for AAA AA C D 9V 1.5V Button Cell Household Batteries Model BT-168"
item_0037,"NETGEAR Wi-Fi Range Extender EX6120 - Coverage Up to 1500 Sq Ft and 25 Devices with AC1200 Dual Band Wireless Signal Booster & Repeater (Up to 1200Mbps Speed), and Compact Wall Plug Design, White"
item_0038,"amFilm Screen Protector for iPad Mini 5/iPad Mini 4, Tempered Glass, 1 Pack"
item_0039,"Fujifilm Instax Mini Instant Film, 10 Sheets__5 Pack(Total 50 Shoots)"
item_0040,"Logitech M510 Wireless Computer Mouse ??Comfortable Shape with USB Unifying Receiver, Back/Forward Buttons and Side-to-Side Scrolling - Red"
item_0041,"Bluetooth Audio Adapter for Music Streaming Sound System, esinkin W29-us Wireless Audio Adapter Works with Smart Phones and Tablets, Wireless Adapter for Speakers"
item_0042,"Apple Magic Mouse 2 (Wireless, Rechargable) - Silver"
item_0043,"sephia SP3060 Earbuds - HD Bass Driven Audio, Lightweight Aluminum in Ear Headphone, S/M/L Ear Bud Tips, Earphone Case, 3.5mm Tangle-Free Cord - for Music, Podcasts, and More (Without Mic)"
item_0044,"Amazon Basics HDMI to DVI Adapter Cable, Bi-Directional 1080p, Gold Plated, Black, 3 Feet, 1-Pack"
item_0045,NB North Bayou Monitor Desk Mount Stand Full Motion Swivel Monitor Arm with Gas Spring for 17-30''Computer Monitors(Within 4.4lbs to 19.8lbs) F80
item_0046,SAMSUNG TV Remote Control BN59-01199F by Samsung
item_0047,"Logitech Z623 400 Watt Home Speaker System, 2.1 Speaker System - Black"
item_0048,"YI Home Security Camera, 1080p 2.4G WiFi IP Indoor Surveillance Camera with Night Vision, Motion Detection, Phone App, Pet Cat Dog Cam Works with Alexa and Google Assistance"
item_0049,Universal Remote Control for Most Samsung LCD LED HDTV 3D Smart Home Entertainment TVs (One pcs)
item_0050,"Fintie Rotating Case for iPad 6th / 5th Generation (2018 2017 Model, 9.7 inch), iPad Air 2 / iPad Air 1-360 Degree Rotating Protective Stand Cover Auto Sleep Wake, Composition Book"
item_0051,"Cellet Car Cup Holder Phone Mount Compatible for Apple iPhone 14 13 Pro Max Mini 12 SE Galaxy S22 S21 S20 Note 20 0 LG Motorola Moto, Google Pixel (Fit for Tesla Model 3 and Y)- Extra Long Neck"
item_0052,"Bose Solo 5 TV Soundbar Sound System with Universal Remote Control, Black"
item_0053,"iFixit Pro Tech Toolkit - Electronics, Smartphone, Computer & Tablet Repair Kit"
item_0054,"Amazon Basics 3.5mm Aux Jack Audio Extension Cable, Male to Female, Adapter for Headphone or Smartphone, 6 Foot, Black"
item_0055,"JETech Case for iPad Air 1st Edition (NOT for iPad Air 2/3/4/5), 9.7 Inch, Smart Cover with Auto Wake/Sleep (Dark Grey)"
item_0056,"Amazon Basics Full Motion Articulating TV Monitor Wall Mount for 26-55 Inch TVs and Flat Panels up to 80 Lbs, Black"
item_0057,"Amazon Basics 5-Pack DisplayPort to HDMI Display Cable, Uni-Directional, 1920x1200, 1080p, Gold-Plated Plugs, 3 Foot, Black"
item_0058,"RCA to HDMI, GANA 1080P Mini RCA Composite CVBS AV to HDMI Video Audio Converter Adapter Supporting PAL/NTSC with USB Charge Cable for PC Laptop Xbox PS4 PS3 TV STB VHS VCR Camera DVD (Black)"
item_0059,"UGREEN Tablet Stand Holder Adjustable Portable Desktop Dock Office Compatible for iPad 10.2, iPad Pro 11 Inch, iPad 9.7, iPad Mini 5 4 3 2 iPad Air iPhone 14 13 12 Black"
item_0060,"NEEWER Ring Light Kit: 18""/48cm Outer 55W 5600K Dimmable LED Ring Light, Light Stand, Carrying Bag for Camera, Smartphone, YouTube, TikTok, Self Portrait Shooting, Black"
item_0061,Apple Lightning to 3.5 mm Headphone Jack Adapter
item_0062,"Apple EarPods Headphones with Lightning Connector. Microphone with Built-in Remote to Control Music, Phone Calls, and Volume. Wired Earbuds for iPhone"
item_0063,"Handsfree Call Car Charger,Wireless Bluetooth FM Transmitter Radio Receiver,Mp3 Audio Music Stereo Adapter,Dual USB Port Charger Compatible for All Smartphones,Samsung Galaxy,LG,HTC,etc."
item_0064,"TECKNET Wireless Mouse, 2.4G USB Computer Mouse with 6-Level Adjustable 3200 DPI, 30 Months Battery, Ergonomic Grips, 6 Buttons Portable for PC, Chromebook, Mac - Red"
item_0065,"Betron BS10 Earphones Wired Headphones in Ear Noise Isolating Earbuds with Microphone and Volume Control Powerful Bass Driven Sound, 12mm Large Drivers, Ergonomic Design"
item_0066,"Amazon Basics 3.5mm Aux to 2 RCA Adapter Audio Cable for Stereo Speaker or Subwoofer with Gold-Plated Plugs, 8 Foot, Black"
item_0067,"Emergency Hand Crank Radio with LED Flashlight for Emergency, AM/FM NOAA Portable Weather Radio with 2000mAh Power Bank Phone Charger, USB Charged & Solar Power for Camping, Emergency"
item_0068,"Upgraded, Anker Soundcore Boost Bluetooth Speaker with Well-Balanced Sound, BassUp, 12H Playtime, USB-C, IPX7 Waterproof, Wireless Speaker with Customizable EQ via App, Wireless Stereo Pairing"
item_0069,"Amazon Basics Toslink Digital Optical Audio Cable, Multi-Channel, for Audio System, Sound Bar, Home Theatre, Gold-Plated Connectors, 9.8 Foot, Black"
item_0070,"fire-Cable Plus Wireless Adapter, Powers Streaming TV Sticks Directly from TV USB Port (Eliminates AC Outlet and Cords)"
item_0071,"HDMI Switch, GANA 4K HDMI Splitter 3 in 1 Out, 3-Port HDMI Switcher Selector with Pigtail HDMI Cable,Supports Full HD 4K 1080P 3D Player, HDMI Hub Compatible with Fire Stick,HDTV,PS4 Game Consoles,PC"
item_0072,"Amazon Basics USB Type-C to USB-A 2.0 Male Charger Cable, 6 Feet (1.8 Meters), White, Laptop"
item_0073,"Jiusion 40 to 1000x Magnification Endoscope, 8 LED USB 2.0 Digital Microscope, Mini Camera with OTG Adapter and Metal Stand, Compatible with Mac Windows 7 8 10 11 Android Linux"
item_0074,"Apple EarPods Headphones with 3.5mm Plug. Microphone with Built-in Remote to Control Music, Phone Calls, and Volume. Wired Earbuds"
item_0075,XRT112 Replacement Remote Control fit for Vizio Smart Internet LED TV with Netflix/iHeart APP Keys
item_0076,"The Bose SoundLink Revolve, the Portable Bluetooth Speaker with 360 Wireless Surround Sound, Lux Gray"
item_0077,"Fintie Case for iPad 9.7 2018 2017 / iPad Air 2 / iPad Air 1 - [Corner Protection] Multi-Angle Viewing Folio Cover w/Pocket, Auto Wake/Sleep for iPad 6th / 5th Generation, Ocean Marble"
